,Consumer complaint narrative
69,"My mortgage company is FREEDOM MORTGAGE. I live in Florida and experienced hurricane Ian followed by hurricane Nicole in XX/XX/XXXX. We were declared a Federal Disaster Area on XX/XX/XXXX. We were told by multiple Real Estate Agents that our lender is required to give relief with a 3 month forbearance on our mortgage, thus placing these moths at the end of the loan. And our next due date would be XX/XX/XXXX. My husband, XXXX, Called Freedom Mortgage in XXXX. He requested information directly about the forbearance that would relieve our payment and move it to the end of the loan. They told him they could do it and would be happy to set that up for us. This was the end of the call. We did not pay XXXX Mortgage but did continue to pay into our escrow. We had not heard anything more and called back in XXXX to see if we needed to complete anything or if everything was still good to go. XXXX ensured via phone call that we were not going to owe this money and we were told no, on a recorded line. They did request documents for us to fill out, they did not send them until XXXX XXXX. These documents asked for things like paycheck check stubs and bank statements. We called and asked why would we need to fill these forms our when the state was declared a state of emergency, the agency replied that we were correct and not to fill out the forms. We also paid into the escrow XXXX all before the end of XXXX. I called Freedom mortgage back after my husband on XX/XX/XXXX as I was worried, we did not receive collecting calls or any late fees during this time but was still very unsettling. I spoke to XXXX # XXXX. During this call he was very egger to get to the bottom of it but told me that the VA is the reason we can not complete this forbearance of placing three months in the end of the loan. He stated the VA will not allow them, Freedom Mortgage to do this. I asked why we were not told in XXXX, he stated the agents that we were dealing with should have been trained. I asked what we were to do as multiple agents told us this was okay and it is not XXXX. He was adamant there was nothing and we would owe the money, explaining that they just give us a break and then ask for it all after that 3 months. I let him know I would have just paid if that were the case. He told me that different agents applied for different things like covid relief which we did not ask for and was not a thing past XXXX XXXX. He was going to go back and review all the recorded calls to verify what I was being told and would return my call. I asked him on a recorded line if I should pay as I was nervous he stated if you pay it will go towards XXXX, XXXX XXXX which are the months you are trying to place at the end of the loan so you should wait. So I did. I also waited for his call which never came. I called multiple times and no return. While waiting for his call, I called the Veterans Benefits Administration to find out what we can do to get this approved as XXXX told me it was them who said no. I spoke to the VA Home load department directly with the VA in the Loan protection Policy/Procedure department. They told me under no circumstances can they tell Freedom mortgage to not do something or to do something but they encourage them to take care of the veterans. They stated there is many calls & complaints about this but ensured me that the VA doesn't hold the power to make them do anything. They provided me with Special relief following a hurricane Circular which is basically show what measures mortgagees may employ to provide relief, which again XXXX told me they told freedom mortgage no. XXXX never took our call or called us back, we requested to talk to someone over XXXX, we believe XXXX was a supervisor as that is what we asked for when we talked to XXXX. Late XXXX we now have XXXX # XXXX she voiced the findings that XXXX notated our account with. Many wrong things told to us that shouldn't have been. Also let us know that what we called for in XXXX was never actually submitted for. Saying they applied for Covid relief which they should have been doing past XX/XX/XXXX. At this time I owed XXXX. She told me about options with splitting this up over 6 months or 12 months. I told her this was not an option. I need it how I requested in XXXX and was told it would happen. I told her my % could not increase, that would also not be an option. While on the phone she applied for what we needed which was 3 months placed at the end of the loan and no change to our %. She said she would know in 5 business days and it would likely be approved and she apologized for everything that happened and ensured me that the agents would receive training. She asked me to call her between XXXX XX/XX/XXXX. I did. No answer or return call. Same thing that happened with XXXX. No one could get her on the phone, they asked if they could help. I wanted XXXX. wouldn't happen. Late last week I had an agent tell me they would help me as they can see notes on the screen and told me that they were reviewing my request and a decision was not made yet and they should have sent a letter on XX/XX/XXXX. After hanging up I thought to myself HOW, I talked to XXXX and she didn't apply for what I needed until late XXXX. So I called back. The agent told me that what XXXX says she applied for would not happen and I needed to pay the money back sooner than later. I kindly ended the call and reached out to a lawyer and gave the information to him. I would prefer not to go this route and have things settled the way they told me they would be. Thank you for listening."
70,"Rushmore Loan Services has repeatedly made account errors on my loan files. I have 4 loans at Rushmore Loan Management Services ( https : //www.rushmorelm.com/ ). I am NOT able to access any of my loan data using their on line system. Each and every time I MUST call in, spend 1 or more hours on the phone to deal with their offshore "" support team ''. These people are not well trained and the impact is often times I need to call back in to get the critical information I need in order to manage my accounts.

Just last week Rushmore made a substantial miscalculation to one of my loan accounts which caused my payment to increase {$330.00} per month! This is financially impactful and an error not caused by me. THEY must make this right!! 

I wish my broker NEVER referred these loans to Rushmore and I will be contacting the lender to have these loans moved to another processing company"
71,"Lender relabeled a mortgage as a "" Home Equity Installment Loan '' and are telling me that, for example, that they are applying {$730.00} for my XX/XX/2023 payment to my Outstanding Principal, yet they show on my XX/XX/2023 account statement that they only applied {$440.00} to my account principal for XX/XX/2023. 

The numbers are wrong and it was supposed to be a mortgage. The difference has amounted to more than {$15000.00} so far. T The lender is PNC BANK."
72,"I had received solicitations from Carrington Home Mortgage for some time regarding refinancing my home to get cash out and pay off additional debts. I had phone calls and received solicitations when logging into the Carrington Home Mortgage portal to make my payments. 

On XX/XX/2022 I discussed my options with a Mortgage Loan Officer out of Arizona. His name is XXXX XXXX XXXX. We reviewed my current income, my current debts and decided to move forward with a Second Mortgage through Carrington Home Mortgage, as he stated that all look to be in line with their requirements and I could get up to 85 % of the home value which their portal stated I had a estimated home value of {$480000.00}. I wanted enough to get my current debts paid off and we discussed putting the Loan to Value on an estimated {$450000.00} so that we would be okay with paying off my debts. This say week I received a debt collection call from Carrington Home Mortgage saying I was late on a my first mortgage and a payment was due or information would be sent to the credit agencies, however I have until the 15th of each month to make a payment. This was a violation of XXXX, as this was an unfair call and deceptive knowing I have additional days to make my payment. I informed the agent on that call that I was getting a second mortgage and was also going to be making my payment online. I was very confused as to why I was receiving this call when there was clear communication with XXXX of Carrington Home Mortgage Loan Officers that I was making payment to them and had never missed a payment. 

XXXX sent over documents which were signed and sent back, he also gave me a list of documents I needed to upload. I proceeded to upload requested documents and XXXX asked me to email them to him as well as it would be easier. As I reviewed the Initial Disclosures, there was an error and XXXX said this would be corrected on the Closing Documents. Essentially {$1700.00} in fees would be removed when the loan was in processing and mentioned I would need to pay for an appraisal which would be {$550.00} and could be put on a credit card that we are paying off. All of this communication was via email. During these email exchanges I let XXXX know that I needed to contact my old employer for two years of W2 's and was able to get those documents uploaded, I also send him two years of tax transcripts and returns to help with the loan processing. 

After all documents were uploaded and everything XXXX mentioned needed to be signed were signed, I asked what were the next steps via email and he said all is great, we will just wait for processing. 

On XX/XX/XXXX, I emailed XXXX to see what was going on because I had not heard anything nor had been informed of an appraisal. He responded that there was no need for anything and he or the processor would reach out to me with next steps. The next day XXXX talked to me and he forgot to email the link for the appraisal and because it's a 2nd that the appraisal should only be {$220.00}. He then sent a link to me and I was able to go in and pay for an appraisal which was listed as {$550.00} and he said there could be glitch in the system but to pay it anyway and I put the {$550.00}, on the XXXX XXXX Credit Card which was being paid off with the 2nd mortgage. This was via email exchange. He said that at the end of the day, he would made sure it was squared away either way on the mortgage or to pay for it. 

On XX/XX/2022 I had an appraiser come out to the home and perform an appraisal. The value came back as {$450000.00} on the Cost Approach, and {$430000.00} on the Sales Comparison Approach. 

I emailed XXXX on XX/XX/XXXX to ask which valuation Carrington would be using for the mortgage and received no response. On the same day, XX/XX/XXXX, I got a notice of incomplete application and email XXXX again to ask why I was receiving that. I had already uploaded documents, I had already signed documents, I had an appraisal and then was receiving a notice of incomplete application. 

I received no response from XXXX and replied to the email address where I got the notice of incomplete application, this was XXXX manager XXXX XXXX. I also attempted to call XXXX and did not receive an answer. This all took place on XX/XX/XXXX. 

I attempted to call XXXX several times over the next week with no response. I also called another loan officer with Carrington Home Mortgage who answered via their general line and told me he found the loan application, and that XXXX had not taken action on it. He gave me the contact information for XXXX XXXX, and I told him I had already attempted to contact XXXX XXXX. That loan officer then gave me the XXXX 's contact information, that XXXX is named XXXX XXXX. 

I called XXXX XXXX on XX/XX/XXXX and left a message, and then I emailed XXXX and XXXX once again. This time I told them all docs have been uploaded and signed, nothing is left for me to do and I have not heard back from anyone regarding my 2nd mortgage. I was hopeful to have this process done and approved within the first week of XXXX as XXXX had initially stated that is our timeframe. 

XXXX finally emailed me back less than 10 minutes after my email and told me the loan had not fallen off his radar, but it was in processing and he would let me know the status ASAP by the end of the day. 

I waited until XX/XX/XXXX to reach back out because again, I had not heard anything from XXXX and we were coming up on 30 days since submitting the loan application with no response. I emailed again on XX/XX/XXXX and asked if he was too busy to help, could he get the loan to a loan officer who would help. I also left a voice mail for XXXX and did not hear back. 

I am now past 30 days from initial application, and this is a violation of ECOA. I understand that Carrington Mortgage sent the Notice of Incomplete Application, however this is a false Notice of Incomplete Application to extend their timing and allowance for compliance. The notice was stating I needed to upload documents when had been uploaded and this tactic is used often with mortgage companies to avoid having to follow compliance rules and regulations. 

I worked in the Mortgage Compliance space for many years and find what I have experienced to be a violation on UDAAP, ECOA and privacy ( as the loan officer asked me to provide documents outside of the secure portal ) I would like to have my loan closed so that I can get the high APR debts paid and also the money back for the appraisal. This process along each step and communication was reassured by XXXX XXXX that things were moving and here I am on XX/XX/XXXX, with no updates on the 2nd Mortgage. I have lost a significant amount of trust in Carrington Home Mortgage, and this includes receiving that collections call about the XXXX payment which was made before the XXXX. 

Because I am in the industry, I am aware of CFPB actions taken against Carrington for other violations under the CARES Act, and I would hope this is a one off case that I am experiencing but they are loosing consumer trust and financially impacted me. I ask that the CFPB look at this complaint seriously and consider how these violation may also be happening to other consumers or customers of Carrington Home Mortgage. 

If I am making payments to this Mortgage Servicer and Mortgage Lender, I expect to be treated with respect, in a timely manner, and that this company has knowledge and actively is participating in training and awareness campaigns for compliance to lending and servicing regulations. 

The lack of communication, the lack of character, and the lack of understanding to their mortgage lending and servicing rules including payments is shocking and I am expected to pay for my mortgage throughout the next 28 years on my first mortgage, and do want to complete my refinance to pay off my debts and this would be 30 years of payments. 

Throughout this loan process I was assured that all debts that I discussed with XXXX would be able to be paid, it was just a matter of getting the loan closed. I am still paying my higher APR on debts, and additionally added debt to the XXXX XXXX XXXX per the Loan Officers statements because that would be included in the pay off."
73,"Hello. 
Our mortgage was issues XXXX. The original purchase price was XXXX. XXXX our remaining balance was XXXX, which is 79 %. I submitted an application to remove PMI, because our LTV ratio based on the ORIGINAL purchase price was less than 80 %. The mortgage company is insisting we provide a list of significant upgrades, whoever this should not be necessary because of our LTV ratio. I have tried to explain this to them over email and phone multiple times but the people that handle the request do not have a phone number so the people I call can not help me. I have learned that our mortgage is backed by XXXX XXXX and through phone conversations they have told me that the XXXX XXXX servicing system does not render a property value ( which I dont understand but it seems to be the issue ) I have a right to verify that the current value is at least equal to the original value by a restricted appraisal or a BPO but the mortgage company need to order this appraisal or BPO and they are not willing to do this."
74,"I am writing to file a formal complaint against Freedom Mortgage Corporation ( "" Freedom Mortgage '' ), a mortgage servicing company that I currently have my home loan with for the above mentioned legal address and loan number. On XX/XX/, I submitted a letter of complaint to Freedom Mortgage via their online service portal, detailing my dissatisfaction with their service and the issues I have experienced with their escrow department. However, in a call I had with a representative named "" XXXX '' in their escalations team, I was informed that they were not handling my complaint and did not know where it was. As a result, I sent the same letter to their email on XX/XX/, and have not received any acknowledgement of receipt or response as of the date of this letter. 

In the aforementioned letter to Freedom Mortgage, I expressed my disappointment with their service and the trouble I have had with their escrow department, including an erroneous escrow surplus check I received in XX/XX/, an escrow shortage notice I received in XX/XX/, and the misapplication of my extra payments to my loan principal. Despite numerous phone calls and requests for an explanation, I have not received a satisfactory resolution to these issues, and I am deeply concerned about the handling of my escrow account. 

Furthermore, on XX/XX/, I also requested to have a copy of my loan agreement sent to me, but as of this writing, I have not received it. This lack of response and unresponsiveness is unacceptable and only adds to the growing list of issues I have had with Freedom Mortgage. 

I am seeking the assistance of the Kentucky Department of Financial Institutions in resolving these issues and holding Freedom Mortgage accountable for their poor service. As a borrower, I have the right to be treated fairly and with respect, and I believe that Freedom Mortgage has violated these rights by their handling of my account. 

Thank you for your attention to this matter. I have enclosed a copy of my original letter to Freedom Mortgage for your review, and I look forward to hearing from you soon. 

Below is the body of the letter I submitted on the Freedom Mortgage online service portal. This letter was also emailed to a member of the Freedom Mortgage Escalation team.

To Whom It May Concern, I am writing to express my extreme disappointment with the service I have received from Freedom Mortgage. I have been a customer of your company for several years now, and I have never experienced such frustration and inconvenience as I have with your escrow department. In XXXX of this year, I received a check for {$680.00} from your escrow department, which was supposed to be a surplus because your department had determined that my real estate taxes were only {$80.00}. However, in XXXX, I received another letter from your company informing me of an escrow shortage of {$890.00}. When I called customer service to inquire about this, I was told to mail a check for the shortage amount and mark in the memo "" for escrow account, '' which I did promptly. The check was cashed by your organization on XX/XX/. Since then, I have made two extra payments of {$1000.00}, but your company has not corrected my payment and has not applied the proper curtailments to my loan principal as expected. Instead, I am still being charged {$1000.00} as a payment. I demand that you fix my escrow account immediately. Furthermore, I was misled by your company this year, and I feel that my rights as a borrower under the Dodd Frank Act have been violated. I demand that you retroactively pay my curtailment principal for the months of XXXX and XX/XX/2023 rather than apply the curtailment for this month, since your company did not properly apply my escrow payment on XX/XX/2023. I do not believe the Freedom Mortgage Escrow and Customer Service representives are properly trained in handling my requests over the phone, as every time I call in, they try to peddle me to another department or ask that I submit an online request. I have spent countless hours on the phone with your representives trying to resolve this issue, and I am tired of the inconvenience and frustration that your company has served me. As a result, I do not wish to speak over the phone with any representatives of Freedom Mortgage. Instead, I request that you communicate your action plan to fix your mistake through my email at XXXX. I believe that this will allow for a more efficient and effective communication process and will help to resolve this matter in a timely and satisfactory manner. I understand that your company is the largest provider of VA loans, but I feel that my business has been reduced to just a number to you. I hope that you will take my concerns seriously and take the necessary steps to correct this situation promptly. 
Lastly, I want to express that if your company can not find the time, or competence, to correct your Escrow department 's errors when I make the XX/XX/2023 payment, I will have no choice but to pursue complaints with Consumer Financial Protection Bureau ( CFPB ), the Federal Reserve System, the Office of the Comptroller of the Currency ( OCC ) and the Kentucky Department of Financial Institutions. As a customer, I expect to receive proper and fair treatment from my mortgage company. If your company is unable or unwilling to provide that, I will have no other recourse but to escalate my complaints to the proper regulators. 
This letter is being submitted online through the Freedom Mortgage online customer service portal on freedommortgage.com. I hereby certify that the above information is accurate and truthful to the best of my knowledge. This letter serves as a legal document and a formal notice of my dissatisfaction with the service provided by your company. I reserve all rights to pursue legal action and/or file a complaint with the appropriate regulatory agencies if this matter is not resolved in a timely and satisfactory manner."
75,"XXXXr my mortgage company has been paying my taxes to the wrong parcel. Today I was notified by the XXXX county taxes that I am behind XXXX. XXXX county states in the letter that if this isnt paid they will be selling my home. When I called Mr Cooper they told me the XXXX tax department does not have any phones? And that so would need to send a email. So I emailed my closing papers, the XXXX county tax with the right parcel number. Please help me"
76,"Hello. Once again we are having problems with payment issues with BSI Financial. All you have to do is XXXX them and see their rating and all the negative comments about this company and how they do business. I dont understand why XXXX XXXX them to continue to do business. We were granted a forebearance due to XXXX XXXX XXXX due to XXXX in XXXX of XXXX. We we forced to place a stop payment on our checking account bc they hit it during the forebearance and caused us overdraft fees... they too charged us overdraft fees even though we were in forebearance! We attempted to start auto draft back up in XXXX and thats when the nightmare started. We keep getting that the payments were revoked so we would end up mailing after many calls asking what was going on. We would be told it was fixed. Then the next month would happen and once again there was a problem drafting. All the fees keep being charged to us. In XXXX and XXXX they were drafting multiple times with the same letters stating we were revoking the payments! We werent. We would leave messages with our so called XXXX 's and they NEVER called us back. We have had 2 during this process : XXXX XXXX and XXXX. They give us so called direct extentions but when you go through customer service..they send you to a "" dead '' mailbox with nothing but a Beep. No name, etc. We have never over the past 8 months got a return call, email or text. They sure do know how to send letters telling you they are collecting fees though! XXXX XXXX we called yet again and the XXXX that answered their XXXX # said they could no longer talk to us unless I emailed a HANDWRITTEN NOTE to their customer service email address. I did that. Then the next day we were told to go to our bank and get a letter stating there was NO blocks on our account. We did that on XX/XX/2023. They told us nothing was there to stop payments. We called back and the XXXX rep said they were going to cover all bases and RESIGN us up for auto drafts and that was done on XX/XX/2023. They have attempted to debit our account 4 times since those dates and we keep getting Revoked by customer and today we get a letter that says "" Unable to Locate ''!!! What does that even mean?? They signed us up AGAIN on XX/XX/2023. ALL of their letters come with collection notices for FEES. There is one saying we are 30 days late for XXXX On XX/XX/2023 we costly spent the money to overnight 2 checks to them for mortgage payments. We have not heard anything back from them. I have written, faxed, and emailed 4 different people at one time all letters, documents and XXXX notice of payments. We think these people are in the XXXX  business and ruining peoples lives with negative credit reporting. We have filed a complaint with the XXXX  and we have a call in now to XXXX  to see if we can do anything against the fact they are paid to XXXX their accounts but obviously cant or dont know how. Our Bank said the problem is NOT on their end but the STOP is on their end because they see NO RECORD of them attempting to draft our accounts. IF that was the case... why havent they seen it ... why didnt it fix itself when we were resigned up on XX/XX/2023??"
