,Consumer complaint narrative
0,"My father passed away on XXXX and mother passed away on XX/XX/XXXX. They had an reverse mortgage with bank of america, In XX/XX/XXXX the bank try to foreclose on my father stating that they paid the taxes and insurance on the house we prove that my father paid the taxes and insurance so the bank was denied the foreclosure, after my father passed away on XX/XX/XXXX bank of america file for an hearing in state of south carolina XXXX of XXXX common pleas court to foreclose on the house the lawyer for bank of america stated the same about the bank paying the taxes and insurance but the judge stated that it was prove that my father paid them, the the lawyer for bank of america state that the reverse mortgage was in default because my father Pass away that was not a true statement, what happen the due and payable i was supposed to receive and the chance to sell the house by the heirs, the lawyer had my name and address my father added me in XX/XX/XXXX so if needed they could call and talk to me, when i found the summon ine the mail I call and talk to the lawyer for bank of america he could not tell me what exactly was due, the judge stated he does not understand reverse mortgages so he ruled for the bank to sell the house, all the heirs rights was takng from us, I witness on the application when my parents got the loan and the banker told me that the heirs will have a chance to buy it first that is why I sign to witness and that is why i call bank of america lawyer but the heirs right did not matter and if I was to lie in court like the lawyer did i would have been found in contempt of court, I am the PR for the estate."
1,"Dear XXXX, During Historical event of XXXX XXXX XXXX, we applied to the Forbearance payment plan with WFHM we were approved. 

After their plan end we apply for a loan modification and we were approved. 

After we send all the documents to XXXX there canceled the Loan Modificacin said that it was not signed correct. ( We did in front of the XXXX XXXX XXXX XXXX XXXX, XXXX ). 
The XXXX have been in the same offices for XXXX XXXX 

We reapply to a Loan Modification and we received a proposal to do a Short Sale. 

This is the only House we have and we live with our XXXXXXXX XXXX 

WFHM Asking as to pay the full amount at one ( LUMP-SUP PAYMENT ).

Again WFHM is trying to do ilegal activities.

This info is from CFPB home page. 

Forbearance ends with a payment plan, not a lump-sum payment Homeowners who receive XXXX  hardship forbearance are not required to repay their paused payments in a lump sum once the forbearance period ends. You can talk with your mortgage servicer, or start with a XXXX XXXX XXXX agency , to discuss a repayment plan that works for your situation."
2,"The problem began approx. XX/XX/2022. I had a business loan for {$430000.00} with SPS. My monthly payments were $ XXXX. I had a XXXX % interest rate. For some reason, Select Portfolio Servicing ( SPS ) put money into my checking account ( around {$2800.00} ) that they were not supposed to put in there. I thought it was an escrow overage so I put the money into the stock market and unfortunately, I lost it. Then SPS contacted me to tell me I was behind in my payments. They told me it was not an escrow overage and that they made a mistake putting the money into my checking account and they wanted it back. In XX/XX/2022, I made a double mortage payment of approximately {$5600.00}. However, because my loan is a business loan, they have a default rate of XXXX %. So instead of using that money to catch up on my mortgage, they didn't apply it towards the loan and they sent the payment back to me because I was at default level, which was about {$7000.00} per month instead of {$2800.00}. Since I made the double payment, I believed I was current. I took a business trip to XXXX and I was gone for a month and I was not receiving any mail at my home in XXXX to inform me that I was in default. When I returned to XXXX I advised SPS of these facts but they did not try to help me. I also explained that during the trip to XXXX, my wife and I both contracted XXXX and it affected my earnings. I asked if they could help due to that situation and take me off the default rate so that I could catch up. They explained that it would take a month for them to decide if they would help. I requested that while we were waiting for the one month period if they could take me off the default rate but SPS said they could not do that. So after I waited a month, they declined to help me. Now my situation is worse because now I owe {$14000.00}. I contacted them in XXXX of XXXX five different times to see if they could help me fix this situation but I could only leave messages and no one would call me back. I had to come up with the money which put me in a hardship situation to get out of the default rate. At one point, SPS said they would possibly assist me with getting out of the default rate but they did nothing despite my circumstances. I spoke to a representative at SPS about the double payment and was told that the they should have never mailed that money back to me but should have applied it to the loan. Since I've had a loan with this company, they have taken out double payme nts three times without my permission. If there is something you can do to assist me with this predatory compa ny, I would appreciate it. 

Thank you. 

XXXX XXXX XXXX XXXX"
3,"THIS IS NOT A DUPLICATE!!!!!!! My complaint submitted XX/XX/23 COMPLAINT ID XXXX has STILL not been resolved. I have been asking for a single point of contact for literal years and have yet to be assigned one. Please give me the name and contact information of my single point of contact! Both Colorado ( CRS 38-38-103.1. Single point of contact ) and federal code ( Civil Code 2923.7 ) mandate that servicers promptly assign a XXXX to the borrowers seeking mortgage modification assistance. Carrington Mortgage LLC has been the servicer on my mortgage for three years, I have submitted countless hardship packets and have been stonewalled and received no response and misinformation from the assorted people that answer the phone in the call center. Please hold this company accountable and make sure that they have met their obligation to assign a single point of contact BEFORE closing the complaint."
4,"At the end of XXXX I turned XXXX years old. My husband has passed away. My husband was a veteran and that is how I have a VA loan. I needed to stay home and isolate during the pandemic out of fear of infection. After the forbearance I requested a VA partial claim on XX/XX/XXXX. The partial claim was sent out XX/XX/XXXX. My memory is not great and I misplaced the documents and did not return them in time. My understanding that since the partial claim did not go through is that I am eligible for another one. I requested an updated partial claim. My interest rate is 3.25 % and a partial claim would have allowed me to keep that rate. My lender refused to send my loan to VA for another partial claim. Then in XXXX, XXXX they ran my loan for a modification and sent me an application. I did not fill the application out correctly and it was denied. I was verbally told the VA was unwilling to help me. I asked for the VA denial in writing and was told they would not provide. My lender is now calling XX/XX/XXXX, XX/XX/XXXX and XX/XX/XXXX. They refuse to take my husband 's name off the calls ( even though they have the death certificate ) and they call and ask for my deceased husband. This is very hard on me as his death was very difficult for me. I ask them not to leave voice messages for my deceased husband as it causes stress, they told me no. I feel as though I am in a bad position because my lender did not send me to VA for the partial claim while it was available. Also, they have sent me to an attorney for foreclosure action. How can they foreclose and kick me out when they blocked assistance that would have brought my loan current?"
5,"On XX/XX/XXXX and XX/XX/XXXX I feel behind on my loan payments and started a accommodation repayment plan to take care of the past due payments due to the COVID-19 global pandemic. This payment arrangement was set up with Flagstar bank who then and currently services my mortgage. Upon completion of these payments arrangement I was informed that my loan would be brought back current and there would be no derogatory remarks on my credit report. My account has been brought back current but the derogatory remarks and late payments still remain. 

This is a clear violation of the "" CARES ACT '' that was passed by congress on XXXX XXXX, which was retroactive from XX/XX/XXXX to the end of the global pandemic. 

I have attached a copy both payment modifications and credit reporting of late payments"
6,"I went on COVID relief plan, and have been trying to get off the plan for over 1 year. Every time I send them all the paperwork they request and I call for a decision they kept on asking for the same paperwork over and over again. They requested that I don't make payments and then they say the application has expired... Went through this process multiple times.. Now they say I need to send them nearly {$200000.00}. Which of course I don't have. There is way so much more to this story PLEASE help me."
7,"My father passed away and my name is now on the Deed of the property. We have provided this information already to the mortgage company. The loan was previously being serviced by XXXX but in the spring of XXXX, it was transferred to Rightpath Servicing. Prior to the transfer, we were offered COVID relief to defer payments for 1 year. We were then advised by XXXX to make trial payments until the modification was final which we did. Once the account was transferred to XXXX, the modification was cancelled due to us not returning the modification documents. We made several calls to XXXX to let them know that we never received the modification documents and were advise that they would resend them. That never happened and we were advised that we would have to try for another modification. We sent the requested documents such as my paystub, an application for assistance, my social security number, and my employment contract. I was advised that my application was complete on XX/XX/XXXX and no further documents were needed. On Friday, XX/XX/XXXX, we were advised that the modification was denied because the previous trial payments were not made. The trial payments ended when we were advised that the previous modification was cancelled, and we would have to start the application again. Furthermore, we have been attempting to contact our single point of contact who is never available when we call in. We have requested callbacks but do not get a callback. I was told on Friday, XX/XX/XXXX that the squeaky wheel gets the grease so I would have to call daily in an attempt to reach my single point of contact. The account is now in Foreclosure status which started right before the latest loan modification application was in the underwriting process. Rightpath servicing is no longer accepting payments and are making it impossible to speak to our single point of contact and have been advised that only the single point of contact can let me know what my options are now."
8,"United Wholesale Mortgage and XXXX XXXX XXXX refinanced our mortgage in XXXX of XXXX. On XX/XX/XXXX I went online to pay my mortgage as I have done every month since the refinance. I noticed that my account stated that I must pay {$10000.00} by XX/XX/XXXX or else my mortgage payment would double for the next XXXX  months. 

After contacting UWM I found that my escrow account had been in arrears and this was the reason for the need to pay {$10000.00}, none of which would go toward my principle. It happened that we had received an insurance payout from the loss of my mother no more than XXXX days prior or I would not have been able to make any payment. I was not able to pay the entire amount so I paid {$5000.00} and said that I would most likely be able to pay the rest by XXXX. At that time I was told that even after paying the XXXX, my monthly mortgage payment was increasing from {$1300.00} per month to a whopping {$1800.00} for the next XXXX  months and that a reassessment would be done in XXXX of XXXX. After making this payment my account on the website was showing that my next monthly payment was not due until XXXX of XXXX. 

On XX/XX/XXXX I called UWM again to pay the remaining {$5000.00}. At that time I was told that I actually owed {$5700.00}, and that I would need to make a payment of {$1800.00} in booth XXXX and XXXX, and every month thereafter. 

While my property taxes did go up, they only went up by {$2000.00}. Bottom line is that the title company grossly underestimated my escrow payment, without the tax increase. And the bigger problem is that UWM never notified me at any time until my phone call on XX/XX/XXXX that my escrow account was low or empty. I was told that I had opted for digital communication and that was the reason. Last time I checked email was digital communication. I have received at least XXXX emails from them since, but none since XX/XX/XXXX when I set up my online account and received a confirmation email. 

This error is unconscionable and would cause a majority of homeowners into foreclosure. There needs to be some repercussion for the title company 's careless calculation of escrow and UWM 's negligence through failure to notify me of the escrow deficit."
9,"We had a mortgage with Wells Fargo beginning in XXXX. In XXXX my husband had XXXX XXXX XXXX XXXX XXXX XXXX XXXX XXXX XXXX XXXXXXXX leading to a long hospital stay then XXXX  months of home confinement with XXXX XXXX XXXX XXXX XXXX XXXX XXXX XXXX XXXX XXXX XXXX When the battle with the XXXX had finally been won the XXXX  XXXX specialist cleared him to begin XXXX XXXX  and a home program and was finally cleared to go back to work after another XXXX months. 

One year had passed with no work or paychecks and with 2 college tuitions it became very difficult to stay on top of our monthly expenses.

Then the real estate market crashed with my husband a XXXX  and me a XXXX  he was forced to file for unemployment until that expired in XX/XX/XXXX. 

In order not to default on our mortgage we were forced to wipe out our entire savings account, cash in both our XXXX XXXX  's and even sold some of my jewelry to stay afloat. 

We contacted Wells Fargo on many occasions with of course no resolution. We were advised to meet us with XXXXXXXX XXXX XXXX XXXX  XXXX to work through a loan modification. I have a binder full of documents that were submitted over and over again to Wells Fargo and what did they come back with for a solution? # 1 We were spending too much money on groceries and # 2 give us a 6 month moratorium on payments but at the end was a balloon payment for the full amount! They just had us go through the motions with NO intention of modifying the loan.

During this time we had to put our house on the market ( remember it was during the real estate crash! ) and ended up selling it like a fire sale and losing over {$75000.00}.

Had we received the modification we could still be in our house that we built back in XXXX with no mortgage instead we had to sell the house at a loss and at XXXX XXXX XXXX we will NEVER recover from this. Although President Obama had pushed these mortgage companies to do right by their clients they never had any intention of providing any relief. 

I had submitted a claim to you but you "" closed '' the complaint when Wells Fargo said they only hold records for 7 years and couldn't "" find '' our account. Serioiusly??? That was a sufficient reason to close the file? They are one of the worst companies for so many ways they have screwed their customers and should not be allowed to continue their illegal tactics. How is it they only keep records for 7 years? How does that work in fixing their past mistakes without any records? 

For their convenience here is my mortgage number they "" couldn't find '' XXXX. 

BTW the XXXX XXXX  XXXX XXXX admitted they only had ONE modification out of the hundreds that applied."
10,"Regions Bank filed a lien on my property at XXXX XXXX XXXX Tennessee XXXX on XX/XX/2007. I recently contacted XXXX XXXX XXXX at phone # XXXX, ( XXXX ). I have contacted several regions associates and every XXXX keep passing me to someone else ( from XXXX branch to another branch ) but getting no results. The address to Regions Bank that has filed the lien on my property is XXXX XXXX XXXX XXXX XXXX XXXX XXXX Alabama XXXX. I find this debt to be invalid and possibly fraudulent. Thank you for investigating this matter."
11,"My mortgage co. claimed i have missed payment without providing any proof or documents to me. I have not missed any payments i have bank statements to prove them wrong, but the mortgage co. will not listen or provide proof. instead they put my mortgage in a loan modification with a higher interest. 

Shellpoint mortgage"
12,"This Company i, e, Wellsfargo Charged Me {$400000.00} To Bring My Account Current in The Past & They Charge Me Money Every Year For Having Escrow Low Due To Their Calculations! I Feel It was Illegal to Charge Me {$400000.00} Without Me being Able To Bring My Account Current In The Past! I want To Know If I Am Due Monies For Past & Present Charges! Due To The current Settlement!"
13,I have tried three separate times to work with the loss mitigation team with Carrington Mortgage group and applied for forbearance in which the company denied all request for loan modification even when I had agreed to a loan modification in three separate payments presented to me by the company. Now the company refuses to look over my application for loan modification once again and has placed my home in foreclosure and has not made it easy for me to get any answers with the foreclosure time frame to stop the foreclosure process and work out a deal with me.
14,"I get XXXXXXXX XXXX XXXX  XXXX Wednesday of the month and my mortgage with midland mortgage, is due by the XXXX of every month. Every month I get charged a late fee ( $ XXXX {$9.00} ) I have tried to change my due date to no avail. I call every month to get my late fee credited, to my knowledge, I was under the impression that the requested fee was credited every month til XX/XX/22 I was informed that I am only allowed 1 credit a year. So the other 11 calls for the late fee credit did not actually happen. The fee may be minor but it adds interest to my overall balance of my mortgage. 
I was told that I would have to sign an agreement for midland mortgage to electronically withdraw my payment. I declined due to past increases that I was unaware of."
15,"I've now missed two closing dates XX/XX/XXXX and XX/XX/XXXX due to no negligence on my part. The underwriter is refusing to approve my loan in spite of being qualified. Each time the closing date is near, the underwriter adds items to be provided. I've had to supply unreasonable documents that have nothing to do with being able to afford the home. I'm a XXXX woman, on the loan alone and I believe a XXXX  woman making my income, close to XXXX, would not be discriminated against the way I am. I've constantly been told "" this is the last item needed '', yet right before closing, more things are added. Making it impossible to make closing deadline. They can't lawfully deny me because I qualify, so I'm being discriminated against in hopes I don't comply, so the loan can then be denied. This is unacceptable and I will fight all the way to the Supreme Court if needed to fight this."
16,"PHH decided, without asking me or receiving a request from me, to take over my homeowner insurance policy payment. I had a valid policy for homeowner 's insurance through XXXX XXXX, and PHH decided that PHH would to pay it. That is a problem for me, because PHH will charge me more money than XXXX XXXX did if I paid it on my own. Now, the insurance company says that they can't talk to me, that I have to talk to the mortgage company. The mortgage company says that I need to call my XXXX XXXXXXXX Trustee, who has nothing to do with the issue of the mortgage company taking over my homeowner 's insurance policy without my request, and without talking to me."
17,"I called in to pay my mortgage on XX/XX/2022 to ensure my account did not fall 30 days past due. I spoke to a representative over the phone who assisted me with processing the payment and provided me with a confirmation number. I received a notice that my mortgage was 30 days deliquent and the company informed me they had no recollection of my call. According to their records there were no notes on the account. I pulled up my call log and I called in at XXXX  that morning and spoke with someone who processed the payment for me. I asked the employee to pull the call. The managers shared with me they do not record all of their calls and could not locate the call. I have a 100 % on time payment history prior to this, and I take pride in that. I should not be penalized because their representative and their system did not document the interaction accordingly and factually. I have researched the company, New Rez and apparently this happens often. I am requested my payment history be reported accurately and timely, as my bill was paid within my 30 day window."
18,"XXXX SUBMITTED ON XX/XX/XXXX PRODUCT Mortgage ISSUE Trouble during payment process Wells Fargo Executive Office responded XX/XX/XXXX that {$16000.00} paid by a Federal Agency to Wells was entered and there was a transfer error not properly corrected before Wells dumped my loan to XXXX  - Wells had over 45 days from XX/XX/XXXX to XX/XX/XXXX correct this problem. 

Wells Fargo has failed to carry out the legal process upon receipt of Federal Funds and proper distribution to homeowner account. Wells showed utter contempt for homeowners gaining assistance from a Federal Agency to make this payment and borders on retaliatory conduct. Why was my loan dumped during a federal fund payment process transfer days after loan payment was made to Wells? Why has almost 55 days passed and NO CORRECTIVE action taken by Wells to notify XXXX? Is Wells attempting to keep the Federal Funds and not perform legal due diligence to pay FEDERAL FUNDS into the homeowner account? Question is WHY? Wells should be held accountable. 

Wells response letter dated XX/XX/XXXX - "" stated check sent for XXXX -- Wells can confirm we didn't receive a check in the amount of {$17000.00} '' -Wells also stated information was not sent for a Modification - both statement border on deceptive practices and scams! Worked closely with Home Preservation XXXX @ XXXX that received all my documents not once but several times. ( see attachments ) This letter borders on Deceptive Practice and RETALIATION for seeking mortgage assistance. A FEDERAL Homeowner RIGHT! 

Wells has added more deleterious harms to the homeowner. For ex : Wells Fargo added {$3200.00} legal fees for FORECLOSURE ( never filed ) to the loan transfer to XXXX  -- not warranted ( see last statement from Wells XX/XX/XXXX ) NO LEGAL FEES existed. My home was NOT in Foreclosure!! - My complaint is that XXXX is moving fast ( within 30 days ) to foreclose on my home due to Wells Fargo deceptive practices and discriminatory retaliation. Wells Fargo should be held accountable after over 55 days for not transferring FEDERAL FUNDS to XXXX!!"
19,"On XX/XX/23, XXXX ( XXXX XXXX ) from the "" advocate '' area ( I guess? ) called me and left a voicemail. With no information. No direction. No help. No reason. NOTHING. Just XXXX, Roundpoint mortgage. Call us back. *END* Their phone tree takes far too long. There was no direction, no 'general ' area to talk to someone who can get me to the right place. I have spent 45 minutes on the phone with them and still do not have an actual answer as to why I was called.

Further, the amount of literature/information that was provided regarding whether autopay was or was not set up, who/how/when payments that were set up with the old company are or are not going to be switched over etc. were all confusing as XXXX. Some of the emails I received I have a minor in finance. I was a XXXX in college for a finance class. While I am not the smartest in the area, I am certainly far above average, so if I can not dissect that information, what hope does the average ( or below average ) person have? 

A company that handles dollar amounts the size of mortgages needs to have a level of service that is commensurate. A reasonable amount of time with any customer service representative should at least indicate if it is worth my time to discuss further. To find out that this was a voicemail in regards to a complaint I filed about the transfer process being garbage was a full circle failure by this company."
20,"On XX/XX/XXXX I then called the foreclosure attorney XXXX with XXXX XXXX XXXX XXXX, she stated that after our conversation she received confirmation from her client to proceed with the foreclosure and that she made one attempt to alert me of the foreclosure still moving forward but was not able to reach me and there fore my home was auctioned off with out no other publication and after I received confirmation from both XXXX and the attorneys handling the foreclosure.

In addition I am attaching the foreclosure publication documents I received on XX/XX/XXXX showing Wells Fargo as the prior mortgage servicer named as the foreclosing mortgage servicer on record but as I stated and have attached the Serving transfer letter Wells Fargo was no longer involved with my home as of XX/XX/XXXX. I believe my home was illegally foreclosed on and that XXXX and its investors and Trustees did not have the proper authority to foreclose on my home."
